1;"Vicino a quale citt… si trova la basilica di ""Nostra Signora di Bonaria "" ? ";Cagliari ;Palermo ;Genova ;;12;Nel marzo del  1370 il comandante di una nave in balia di una tempesta fece gettare a mare il carico. Appena una cassa , di cui non si conosceva il contenuto, tocc• le onde, la tempesta si calm• . Vero o falso ? ;Vero ;Falso ;;;13;La cassa si aren• vicino a cagliari, in un luogo chiamato _;Bonaria ;Golfo della Madonna ;Spiaggia dei miracoli ;;14;La cassa venne trovata da due monaci che l'aprirono e videro che conteneva _.;un prezioso vangelo ;una statua della Madonna con in braccio il bambino ;un quadro della Madonna ;;25;"Nel 1907, papa Pio X proclam• la "" Madonna di Bonaria "" _.";Patrona Massima della Sardegna ;Patrona di Cagliari ;Patrona delle citt… marinare ;;16;"La "" Madonna di Bonaria "" Š la protettrice dei __..";costruttori di navi ;falegnami ;marinai ;;3